,subject,id,author,date,time,content,clean_content,refs,urls,classification
14472,/Chasergen/ - Art Edition,34690352,Luna,02/16/24,15:15:13,>>34688720I found this img that explains how it feels to me when I have a crush,"
I found this img that explains how it feels to me when I have a crush",['>>34688720'],[],0
13454,/ftmg/ - tranny hater edition,34689463,Anonymous,02/16/24,13:54:13,>reading /tttt/ after time away,>reading /tttt/ after time away,[],[],1
12704,/lesgen/ - dream house edition,34687789,Anonymous,02/16/24,11:21:37,>>34687714for ash this is the equivalent of his mom bringing home a coon with grills and a glock i feel so bad for kids with slut moms that put getting pussy and going to the club over their children baka,"
for ash this is the equivalent of his mom bringing home a coon with grills and a glock i feel so bad for kids with slut moms that put getting pussy and going to the club over their children baka",['>>34687714'],[],0
9255,/mtfg/ - Revachol edition,34683599,Anonymous,02/16/24,00:04:29,>>34683587Goodnight pain.,"
Goodnight pain.",['>>34683587'],[],0
18663,/gaygen/ - bottoms edition,34694014,Dan,02/16/24,20:19:07,It finally clicked today. I do not belong in these threads with bitter sexless losers. I don’t even want to imagine what other gay people who post anonymously on 4chan look like. I know that’s why they hate me.,It finally clicked today. I do not belong in these threads with bitter sexless losers. I don’t even want to imagine what other gay people who post anonymously on 4chan look like. I know that’s why they hate me.,[],[],0
12245,34685530,34687707,Anonymous,02/16/24,11:14:10,">>34685646Its really not that bad. Have you ever been with someone with a neovag? I mean the healing period, sure its gross, but after that? Pretty much just a pussy.","
Its really not that bad. Have you ever been with someone with a neovag? I mean the healing period, sure its gross, but after that? Pretty much just a pussy.",['>>34685646'],[],1
13470,you DO know how to cum from ni(...),34689265,Anonymous,02/16/24,13:34:23,Mine just hurt when they're played with so I only like gentle touch,Mine just hurt when they're played with so I only like gentle touch,[],[],0
9276,/mtfg/ - Revachol edition,34683822,Anonymous,02/16/24,00:33:59,>>34683689Take more vitamin d.,"
Take more vitamin d.",['>>34683689'],[],0
6674,34678776,34682443,Anonymous,02/15/24,22:08:56,>>34678796Children can consent to marriage with other children. Children can also decide which puberty they want.,"
Children can consent to marriage with other children. Children can also decide which puberty they want.",['>>34678796'],[],1
14191,34687232,34689882,Anonymous,02/16/24,14:35:33,">>34689817I dont care if im 97 and i die 12 hours after the surgery, im getting that grammy futa cock and im fucking as many women as possible with it.","
I dont care if im 97 and i die 12 hours after the surgery, im getting that grammy futa cock and im fucking as many women as possible with it.",['>>34689817'],[],1
17381,34687159,34693204,Anonymous,02/16/24,19:05:36,">>34687159~2,500 sq ft (parents' house)we're probably gonna move into a condo in a few years though, too many basketball american incidents around here","
~2,500 sq ft (parents' house)we're probably gonna move into a condo in a few years though, too many basketball american incidents around here",['>>34687159'],[],1
15923,34680070,34692197,Anonymous,02/16/24,17:40:16,>>34680094the male energy infused in the liquid is harmful to babies,"
the male energy infused in the liquid is harmful to babies",['>>34680094'],[],1
16416,/gaygen/ Imagining the smell e(...),34691852,beenie,02/16/24,17:11:54,">>34691786the S in AIDS is part of the acronym anon. it stands for ""syndrome"". you don't get one AID","
the S in AIDS is part of the acronym anon. it stands for ""syndrome"". you don't get one AID",['>>34691786'],[],0
6714,/mtfg/ - 'choose life' edition(...),34682663,Anonymous,02/15/24,22:26:38,>>34682640it’s literally the exact opposite,"
it’s literally the exact opposite",['>>34682640'],[],0
7599,What are the most important fa(...),34681479,Anonymous,02/15/24,20:50:19,>>34681370calm down mantra,"
calm down mantra",['>>34681370'],[],0
3868,/hrtgen/ - HRT General - #640,34652712,Anonymous,02/13/24,17:34:47,">>34649253Just look at trannies too autistic to understand makeup etc, like Chris-chan. He’s like a decade of HRT and wears women’s clothes, but he’s had zero surgery, laser, or makeup practice.","
Just look at trannies too autistic to understand makeup etc, like Chris-chan. He’s like a decade of HRT and wears women’s clothes, but he’s had zero surgery, laser, or makeup practice.",['>>34649253'],[],1
2333,/st4tg/ - st4t general,34674680,Anonymous,02/15/24,12:16:07,">>34674666I mean Florida is really unsafe for trans people rn, you should see about leaving.","
I mean Florida is really unsafe for trans people rn, you should see about leaving.",['>>34674666'],[],1
2258,34673736,34676697,Anonymous,02/15/24,14:46:15,">>34674857Having a dick doesn't automatically make you a man, anon","
Having a dick doesn't automatically make you a man, anon",['>>34674857'],[],1
11593,34687616,34687686,Anonymous,02/16/24,11:11:37,>>34687667Mans finna hit?,"
Mans finna hit?",['>>34687667'],[],0
618,/clg/ Cis Lesbian General - To(...),34680660,Anonymous,02/15/24,19:38:39,>>34680622Need need need,"
Need need need",['>>34680622'],[],0
7396,/lesgen/ - healing the politic(...),34682237,Anonymous,02/15/24,21:51:51,">>34682223based sexuality abolitionist, lets cut our genitals off and live as nullos with zero visible genitalia","
based sexuality abolitionist, lets cut our genitals off and live as nullos with zero visible genitalia",['>>34682223'],[],0
2831,whats it like seeing a hon IRL,34674261,Anonymous,02/15/24,11:38:49,>>34674216idk i don't think ur ugly. i'd call you mommy and let you top me though.,"
idk i don't think ur ugly. i'd call you mommy and let you top me though.",['>>34674216'],[],0
9050,I fucking hate moids,34684820,Anonymous,02/16/24,03:33:55,">>34684273>can anyone give me any reason to ever interact with a man againbecause unless you are one of the very rare cis lesbians who are unfortunate enough to use this website, you are one, and everything you hate about men is probably present in you as well, and this is just you lashing out because you suck at being one and dont like being called out on it?","
>can anyone give me any reason to ever interact with a man againbecause unless you are one of the very rare cis lesbians who are unfortunate enough to use this website, you are one, and everything you hate about men is probably present in you as well, and this is just you lashing out because you suck at being one and dont like being called out on it?",['>>34684273'],[],0
3542,Straight ftms aren’t real,34678504,Anonymous,02/15/24,16:59:35,>>34678485He's cute he gets a cringe pass for using reddit,"
He's cute he gets a cringe pass for using reddit",['>>34678485'],[],1
11764,/mtfg/ - Revachol edition,34686761,maiq,02/16/24,09:20:21,>>34686737marina hello>>34686742chomp <3,"
marina hello
chomp <3","['>>34686737', '>>34686742']",[],0
14579,Your boyfriend will transition,34690882,Anonymous,02/16/24,15:54:03,">>34689139It's because of all the fillers and botox and anglefrauding trannies use, a lot of them are like this especially the self-aware ones","
It's because of all the fillers and botox and anglefrauding trannies use, a lot of them are like this especially the self-aware ones",['>>34689139'],[],1
13144,/gaygen/ - rugby players editi(...),34689174,Anonymous,02/16/24,13:26:43,>>34689154Remember Dunkaroos? Those were good,"
Remember Dunkaroos? Those were good",['>>34689154'],[],0
4476,/mtfg/ - 'choose life' edition(...),34676621,Anonymous,02/15/24,14:40:34,>>34676521Eh I don't think its that serious,"
Eh I don't think its that serious",['>>34676521'],[],1
11813,/mtfg/ - Revachol edition,34687548,Ginko,02/16/24,10:58:55,">>34687467>Idk how insurance stuff works exactly. Why would that be a burden?from what my mother told me, it's related to our insurance deductible. i can't have procedures that are tooo expensive and even an orchi might be too much unless i can find a provider that does it for a low enough price. america moment","
>Idk how insurance stuff works exactly. Why would that be a burden?from what my mother told me, it's related to our insurance deductible. i can't have procedures that are tooo expensive and even an orchi might be too much unless i can find a provider that does it for a low enough price. america moment",['>>34687467'],[],1
